{
  "$schema": "http://json-schema.org/draft-07/schema#",
  "title": "dotagents repository profile",
  "description": "リポジトリごとの検証設定。製品リポジトリを変更せずに済むよう、製品側ではなくここに置く。作業ディレクトリの git remote との照合で解決する。",
  "type": "object",
  "required": ["match", "checks"],
  "additionalProperties": false,
  "properties": {
    "$schema": { "type": "string" },
    "$comment": {},
    "match": {
      "type": "object",
      "description": "このプロファイルを当てるリポジトリの見分け方。",
      "additionalProperties": false,
      "properties": {
        "remote": {
          "description": "`git remote get-url origin` と照合する部分文字列、またはそのどれかに一致すればよい部分文字列の一覧。'owner/repo' は所有者を固定し、'/repo' はフォークと両方の URL 形式（https と ssh）にも追従する。一覧は複数の名前で届くリポジトリ用。",
          "oneOf": [
            { "type": "string", "minLength": 1 },
            { "type": "array", "minItems": 1, "items": { "type": "string", "minLength": 1 } }
          ]
        }
      },
      "required": ["remote"]
    },
    "cwd": {
      "type": "string",
      "description": "検査を実行する、リポジトリルートからの相対ディレクトリ。省略するとルートで実行する。"
    },
    "spec_system": {
      "type": "object",
      "additionalProperties": false,
      "required": ["kind"],
      "description": "このリポジトリが、コードより前に意図をどこに記録するか。リポジトリごとの事実で、実行時に読まれる置き場所がほかに無い。意図をどこにも記録しないリポジトリでは省略し、場所をでっち上げずに報告でそう書く。",
      "properties": {
        "$comment": {},
        "kind": {
          "enum": ["openspec", "plans", "none"],
          "description": "openspec: openspec/{specs,changes} があり、1 つの change が 1 つのディレクトリ（proposal、design、tasks と、capability ごとの spec delta）。plans: change ごとに Markdown の計画を 1 つ（upstream の writing-plans が作る形）。none: ここでは意図をディスクに記録しないので、規約をでっち上げない。"
        },
        "root": {
          "type": "string",
          "description": "成果物を置くディレクトリ（リポジトリルートからの相対）。openspec なら 'openspec'、plans なら計画ファイルの置き場所。"
        },
        "rules": {
          "type": "string",
          "description": "リポジトリ**独自**の書き方のルールを持つファイル。ここで何かを書く・レビューする前に読む。openspec なら 'openspec/config.yaml'（必須の見出し、規範語彙、MODIFIED の要件は全文で書き直すこと、を定める）。リポジトリが自分のルールを書いているのに汎用の観点でレビューする失敗を防ぐための項目。"
        },
        "validate": {
          "type": "array",
          "minItems": 1,
          "items": { "type": "string", "minLength": 1 },
          "description": "1 つの change を機械的に検査するコマンド。シェル文字列ではなく ARGV で書く。引数 1 つにつき 1 要素で、ちょうど '<id>' の要素が change id に置き換わる。例: [\"pnpm\", \"openspec\", \"validate\", \"<id>\", \"--strict\"]。argv にするのは、プロファイルにパイプライン・';'・置換を紛れ込ませず、change id を独立の要素にしてコマンドへ漏らさないため。シェル（sh/bash/zsh）で始まる argv や '-c' を含む argv はこれを台無しにするので、実行する側が拒否すること。判断より**前に**実行し、出力を根拠として報告する。機械で検査できる spec を読むだけでレビューしない（da-verify がコードに課すルールを意図に当てたもの）。"
        }
      }
    },
    "adr_system": {
      "type": "object",
      "additionalProperties": false,
      "required": ["kind"],
      "description": "このリポジトリがアーキテクチャ決定記録（ADR）を置く場所と、独自の書き方のルール。spec_system が意図について持つのと同じ種類の事実を、判断について持つ。upstream の ADR スキルは置き場所をツリーから推測して docs/adr や docs/decisions に落ち、誰も読まないディレクトリに正しい形のファイルができる。ADR を持たないリポジトリでは省略し、ディレクトリを作らずにそう書く。",
      "properties": {
        "$comment": {},
        "kind": {
          "enum": ["colocated", "directory", "none"],
          "description": "colocated: ADR は対象のコードの隣に置く。directory: ADR をすべて 1 つのルートの下に置く。none: このリポジトリは ADR を持たないので、置き場所をでっち上げない。"
        },
        "roots": {
          "type": "array",
          "items": { "type": "string", "minLength": 1 },
          "description": "ADR を書いてよいディレクトリ（リポジトリルートからの相対）。colocated では置いてよいサブツリー。この外に書くのは前提条件の違反で、判断の問題ではない。"
        },
        "pattern": {
          "type": "string",
          "description": "ファイル名の形。'<subject>' が記録する判断を表す。例: 'ADR.<subject>.md'。既存ファイルに合わせ、別の命名規則を並べない。"
        },
        "rules": {
          "type": "string",
          "description": "判断の書き方について、リポジトリ**独自**のルールを持つファイル。書く前に読む。spec_system.rules と同じファイルであることが多い。"
        }
      }
    },
    "max_attempts": {
      "type": "integer",
      "minimum": 1,
      "description": "同じ検査が連続で何回失敗したら、ゲートがブロックをやめて諦めたことを記録するか。既定は 3。永久にブロックするのはガードレールではない（無人の実行は /clear できない）。諦めは VERDICT ファイルに記録するので、合格と取り違えない。"
    },
    "timeout_total": {
      "type": "integer",
      "minimum": 1,
      "description": "1 回のターン終了で、ゲートが全検査に使ってよい秒数。既定は 300。検査数×個別のタイムアウトはハーネス側の hook タイムアウトを超えうる。そちらに殺されると 0 でも 2 でもない終了で非ブロック扱いになり、遅いスイートが黙って合格になる。templates/ の hook 項目はこれより厳密に大きいタイムアウトを宣言し、先に鳴るのが常にこちらの時計になるようにする。予算が尽きたら、開始しなかった検査を報告してブロックする。実行していないゲート検査は合格ではない。"
    },
    "forbidden": {
      "type": "array",
      "items": { "type": "string" },
      "description": "このリポジトリでエージェントが決して実行してはならないコマンドの部分文字列。デプロイ、破棄、稼働中の環境に触れるもの全般。"
    },
    "checks": {
      "type": "array",
      "items": {
        "type": "object",
        "required": ["id", "cmd", "gate", "agent_may_run"],
        "allOf": [
          {
            "$comment": "An unexplained request to run something by hand reads as arbitrary and gets ignored, so the schema requires the reason rather than a document asking for it.",
            "if": { "properties": { "agent_may_run": { "const": false } }, "required": ["agent_may_run"] },
            "then": { "required": ["delegate_reason"] }
          },
          {
            "$comment": "scope:changed narrows a command to the changed files, which only means anything if the command has somewhere to put them.",
            "if": { "properties": { "scope": { "const": "changed" } }, "required": ["scope"] },
            "then": { "properties": { "cmd": { "pattern": "\\{files\\}" } } }
          }
        ],
        "additionalProperties": false,
        "properties": {
          "id": { "type": "string" },
          "cmd": {
            "type": "string",
            "description": "シェルコマンド。scope が 'changed' のとき、`{files}` が変更ファイルに置き換わる。"
          },
          "gate": {
            "type": "boolean",
            "description": "真なら、この検査の失敗で完了をブロックする。"
          },
          "agent_may_run": {
            "type": "boolean",
            "description": "リポジトリがエージェントの実行を禁じている場合、またはエージェントが使うべきでない資源や認証情報が要る場合に偽。対話中は、エージェントが利用者に実行を頼み、出力を待つ。無人（scripts/loop.sh）では頼む相手がおらず、何ラウンド回しても満たせないので、駆動系は検査を deferred として記録して進む。台帳・実行の締めのメッセージ・PR 本文にその名前を出す（deferred のゲートは緑ではない）。つまりこれらの検査のゲートは CI。禁止しているのは実行であって、検証済みで出すことではない。CI も実行しないなら委ねる先が無いので、意図して gate:false にするか CI に足すこと。"
          },
          "delegate_reason": {
            "type": "string",
            "description": "agent_may_run が偽のとき必須。依頼が恣意的に見えないよう、利用者に示す。"
          },
          "scope": {
            "enum": ["all", "changed"],
            "description": "'changed' は作業ツリーで触ったファイルにコマンドを絞る。"
          },
          "timeout": {
            "type": "integer",
            "minimum": 1,
            "description": "ゲートがこの検査を殺すまでの秒数。既定は 120。タイムアウトはコードについての所見ではなくゲートの不調として扱う。ブロックはするが、理由は 'red' ではなく 'timeout' と記録する（コードの正しさについて何も言っていないため）。max_attempts には数える。数えないと本当に固まる検査が毎ターン永久にブロックする。"
          },
          "mutates": {
            "type": "boolean",
            "description": "この検査の実行が作業ツリーを書き換えうるとき真（lint:fix や format:fix のような自動修正）。ゲートは実行するが、ツリーが変わったら緑ではなくブロックにする。エージェントが終えたつもりのファイルを hook が書き換えたことになり、ループの次の反復が自分の書いていないツリーを読むため。元には戻さない。直すものが無くなれば次のターンで通る。黙って直すゲートの緑は信用できない。"
          },
          "when": {
            "type": "string",
            "description": "条件付き検査の、人が読むための条件。gate が偽のときだけ意味がある。述語では**ない**。実行時に誰も読まない。実際に効く仕組みは `paths`（検査を実行するか）と `cmd` 中の `{files}`（何に対して実行するか）。"
          },
          "paths": {
            "type": "array",
            "minItems": 1,
            "items": { "type": "string", "minLength": 1 },
            "description": "検査を実行する**かどうか**。`scope`（何に対して実行するか）とは直交する。両方の併用は普通で正しい。\"scripts/ が変わったときだけ、そのとき全体に対して\" は `paths` と `scope: all`。リポジトリルートからの接頭辞かグロブ。末尾の /** は接頭辞。変更ファイルのどれかが一致したときだけ実行する。省略すると常に実行。cwd ではなく**ルート**からの相対。\"cwd\": \"pkg\" のプロファイルでも \"pkg/src/**\" と書く。逆にすると何にも一致せず、毎ターン検査を飛ばす。飛ばした検査は `verify --json` の `skipped` に名前が出る。どのゲート検査も受け持たないファイルが変わったら、ゲートは kind not_checked でブロックする。受け持ちの無いファイルはプロファイルの穴で、合格ではない。"
          }
        }
      }
    }
  }
}
