{
  "$schema": "./_schema.json",
  "$comment": [
    "このリポジトリ自身のプロファイル。開発中のツール一式を自分のゲートにかける。",
    "ほかと違い追跡する。公開リポジトリと公開コマンドしか名指さず、動く実例を兼ね、ここで実際に動く唯一のプロファイルでもある。",
    "",
    "'bwkw/dotagents' ではなく '/dotagents' で照合し、フォークとクローン、両方の URL 形式（https://host/owner/dotagents.git と host:owner/dotagents）に追従する。所有者を固定するとフォークでプロファイルが解決されず、ゲートが黙って pass する。",
    "代償は承知の上: 名前が 'dotagents' で始まる無関係のリポジトリも一致し、コマンドが無いので大きな音で落ちる。黙って開くより、音を立てて間違える方がよい。",
    "12 個の検査の `paths` は、どんな変更でもゲートが空にならないよう選んである。`skills-lint` と `da-review-all-overview-contract` には意図して付けない（skills/ とドキュメントを読むので、ドキュメントだけの変更でも何かが走る）。ゲート検査が全部辞退すると kind not_checked でブロックするので、空にできるプロファイルは最もよくある変更で止まる。"
  ],
  "match": {
    "remote": "/dotagents"
  },
  "spec_system": {
    "$comment": "docs/plans/ はこれではない。そこは 🧱 の landing 計画で、scripts/loop.sh が 'What gates it' の見出しで見つける。実装計画は writing-plans が作るもので、loop.sh:plan_files() はここを探す。",
    "kind": "plans",
    "root": "docs/superpowers/plans"
  },
  "forbidden": [
    "setup.sh uninstall",
    "git push --force",
    "git reset --hard"
  ],
  "checks": [
    {
      "id": "shell-syntax",
      "cmd": "for f in scripts/*.sh hooks/*.sh; do bash -n \"$f\" || exit 1; done",
      "gate": true,
      "agent_may_run": true,
      "scope": "all",
      "paths": [
        "scripts/**",
        "hooks/**"
      ]
    },
    {
      "id": "skills-lint",
      "cmd": "./scripts/verify-skills.sh",
      "gate": true,
      "agent_may_run": true,
      "scope": "all"
    },
    {
      "id": "halt-docs",
      "cmd": "./scripts/verify-halt-docs.sh",
      "gate": true,
      "agent_may_run": true,
      "scope": "all",
      "when": "docs/loops.md の停止理由の表と、loop.sh が実際に書く文字列は同じ集合であること。check.sh にもあるが、ゲートでも回さないと check.sh を打たない変更でずれが入る。",
      "paths": [
        "docs/loops.md",
        "scripts/loop.sh",
        "scripts/verify-halt-docs.sh"
      ]
    },
    {
      "id": "gate-tests",
      "cmd": "./scripts/test-verify-gate.sh",
      "gate": true,
      "agent_may_run": true,
      "scope": "all",
      "when": "常に。ゲートは閉じる側に倒れなければならない唯一の部品なので、そのテストは毎ターンゲートする",
      "paths": [
        "hooks/dotagents-verify-gate.sh",
        "scripts/gate.sh",
        "scripts/test-verify-gate.sh"
      ]
    },
    {
      "id": "no-multibyte-after-var",
      "cmd": "perl -ne 'close ARGV if eof; next if /^\\s*#/; exit 1 if /\\$[A-Za-z_]\\w*[^\\x00-\\x7F]/' scripts/*.sh hooks/*.sh",
      "gate": true,
      "agent_may_run": true,
      "scope": "all",
      "timeout": 15,
      "when": "UTF-8 ロケールの bash 3.2 は、波括弧なしの $var の直後の全角文字を変数名に取り込み、未定義の参照で落ちる。macOS の CI でだけ落ちる。${var} と波括弧で囲む。no-bash4 と違い先頭に `!` は付けない。grep は「見つかった」を終了 0 で、この perl は終了 1 で示すので、否定するときれいなツリーが赤になる。",
      "paths": [
        "scripts/**",
        "hooks/**"
      ]
    },
    {
      "id": "no-bash4",
      "cmd": "! grep -rqE --exclude=check.sh '^[^#]*\\b(mapfile|readarray)\\b|declare -A' scripts/ hooks/",
      "gate": true,
      "agent_may_run": true,
      "scope": "all",
      "when": "macOS の bash は 3.2。これらは Linux で通り macOS で落ちる",
      "paths": [
        "scripts/**",
        "hooks/**"
      ]
    },
    {
      "id": "templates-valid",
      "cmd": "node -e 'const fs=require(\"fs\");for(const f of fs.readdirSync(\"templates\"))if(f.endsWith(\".json\"))JSON.parse(fs.readFileSync(\"templates/\"+f,\"utf8\"));for(const f of fs.readdirSync(\"profiles\"))if(f.endsWith(\".json\"))JSON.parse(fs.readFileSync(\"profiles/\"+f,\"utf8\"))'",
      "gate": true,
      "agent_may_run": true,
      "scope": "all",
      "paths": [
        "templates/**",
        "profiles/**"
      ]
    },
    {
      "id": "claude-md-symlink",
      "cmd": "[ \"$(git ls-files -s CLAUDE.md | awk '{print $1}')\" = 120000 ] && [ \"$(readlink CLAUDE.md)\" = AGENTS.md ]",
      "gate": true,
      "agent_may_run": true,
      "scope": "all",
      "timeout": 15,
      "when": "Claude Code は AGENTS.md を読まないので、リンクが通常ファイルになると常時読み込み層が黙ってずれる",
      "paths": [
        "CLAUDE.md",
        "AGENTS.md"
      ]
    },
    {
      "id": "exec-bits",
      "cmd": "! git ls-files -s scripts/*.sh hooks/*.sh | awk '$1!=\"100755\"{print;f=1} END{exit !f}'",
      "gate": true,
      "agent_may_run": true,
      "scope": "all",
      "timeout": 15,
      "when": "スイートはすべて `bash <file>` で呼ぶので、+x が落ちても全部通り `scripts/gate.sh arm` だけが壊れる",
      "paths": [
        "scripts/**",
        "hooks/**"
      ]
    },
    {
      "id": "lint-hook-tests",
      "cmd": "./scripts/test-lint-hook.sh",
      "gate": true,
      "agent_may_run": true,
      "scope": "all",
      "timeout": 120,
      "paths": [
        "hooks/**",
        "scripts/test-lint-hook.sh",
        "templates/**"
      ]
    },
    {
      "id": "installer-tests",
      "cmd": "./scripts/test-setup.sh",
      "gate": true,
      "agent_may_run": true,
      "scope": "all",
      "timeout": 180,
      "paths": [
        "scripts/setup.sh",
        "scripts/test-setup.sh",
        "templates/**",
        "hooks/**"
      ]
    },
    {
      "id": "non-interactive-tests",
      "cmd": "./scripts/test-non-interactive.sh",
      "gate": true,
      "agent_may_run": true,
      "scope": "all",
      "timeout": 180,
      "paths": [
        "scripts/**",
        "hooks/**"
      ]
    },
    {
      "id": "loop-tests",
      "cmd": "./scripts/test-loop.sh",
      "gate": true,
      "agent_may_run": true,
      "scope": "all",
      "timeout": 900,
      "when": "常に。駆動系は無人で作業を PR に出してよいか決めるので、それを止める検査は省けない",
      "paths": [
        "scripts/loop.sh",
        "scripts/test-loop.sh"
      ]
    },
    {
      "id": "da-review-all-overview-contract",
      "cmd": "./scripts/test-da-review-all-overview.sh",
      "gate": true,
      "agent_may_run": true,
      "scope": "all",
      "timeout": 15,
      "when": "da-review-all は、ホストが対応するどの入れ物でも 1 ページの概要を出し続けること"
    },
    {
      "id": "da-demo-video-scenario-check",
      "cmd": "./scripts/test-da-demo-video.sh",
      "gate": true,
      "agent_may_run": true,
      "scope": "all",
      "timeout": 15,
      "when": "da-demo-video の check は、壊れたシナリオを撮影の前に弾き続けること（依存無しで動く）"
    },
    {
      "id": "da-adr-figure-check",
      "cmd": "./scripts/test-da-adr-figure.sh",
      "gate": true,
      "agent_may_run": true,
      "scope": "all",
      "timeout": 60,
      "when": "da-adr-figure の check は壊れた定義を書き出しの前に弾き、build は文字があふれた図を失敗させ続けること（check は依存無しで動き、build の検査は依存がある時だけ走る）"
    },
    {
      "id": "gate-covers-check-sh",
      "cmd": "node -e 'const fs=require(\"fs\");const steps=[...fs.readFileSync(\"scripts/check.sh\",\"utf8\").matchAll(/^[ \\\\t]*step .*?(\\.\\/scripts\\/[a-z-]+\\.sh)/gm)].map(m=>m[1]);const gated=require(\"./profiles/dotagents.json\").checks.filter(c=>c.gate).map(c=>c.cmd).join(\" \");const missing=steps.filter(s=>!gated.includes(s));if(missing.length){console.error(\"not gated by profiles/dotagents.json: \"+missing.join(\" \"));process.exit(1)}console.log(\"all \"+steps.length+\" suites check.sh runs are gated\")'",
      "gate": true,
      "agent_may_run": true,
      "scope": "all",
      "timeout": 15,
      "when": "check.sh に足してこのプロファイルに足さないスイートは、ゲートが回さなくなる。粒度が違う（shell-syntax と no-bash4 は check.sh の 1 ステップ、templates-valid は check.sh に無い）ので数では比べず、check.sh が呼ぶスクリプトを覆っているかを不変条件にする。シェル関数のステップ（構文、CLAUDE.md のリンク、実行ビット）は上に専用の検査がある。ツリーが汚れないかのステップはゲートの中では意味が無い。",
      "paths": [
        "scripts/check.sh",
        "profiles/dotagents.json"
      ]
    }
  ],
  "timeout_total": 1500
}
