{
  "$schema": "./_schema.json",
  "$comment": [
    "Copy this to profiles/<repo>.json and edit. Your copy is gitignored -- profiles name real",
    "repositories and environments, so they stay on your machine.",
    "The leading underscore keeps this example out of profile matching."
  ],

  "match": { "remote": "owner/repo" },

  "cwd": "app",

  "forbidden": [
    "terraform apply",
    "cdk deploy",
    "npm run deploy:"
  ],

  "checks": [
    {
      "id": "lint",
      "cmd": "npm run lint:fix",
      "gate": true,
      "agent_may_run": true,
      "scope": "all"
    },
    {
      "id": "typecheck",
      "cmd": "npm run typecheck",
      "gate": true,
      "agent_may_run": false,
      "delegate_reason": "State the real reason here. It is shown to the user, and an unexplained request to run something by hand gets ignored. Typical reasons: the repository's own docs forbid the agent running it, it needs credentials the session should not spend, or it needs more memory than the session has."
    },
    {
      "id": "unit",
      "cmd": "npm test -- {files}",
      "gate": true,
      "agent_may_run": true,
      "scope": "changed"
    },
    {
      "id": "integration",
      "cmd": "npm run test:integration",
      "gate": false,
      "agent_may_run": true,
      "when": "the change touches a repository, a schema, or a migration"
    }
  ]
}
