{
  "$schema": "./_schema.json",
  "$comment": [
    "いちばんよくある形の実例: リポジトリのルートに Node のパッケージが 1 つ、pnpm のスクリプト。",
    "コピーして使い、ここを直接編集しないこと。接頭辞の '_' には意味がある。ゲートの hook も gate.sh も '_' で始まるファイルを読み飛ばすので、これが実リポジトリを誤ってゲートすることは無い。",
    "配っても安全なのもそのため。一致しうる例は、他人が選んだコマンドがターン終了のたびに走ることになる。",
    "",
    "使い方:",
    "  cp profiles/_example.node-pnpm.json profiles/<your-repo>.json",
    "  そのうえで match.remote を設定し、コマンドをリポジトリに実際にあるものへ置き換える。",
    "",
    "以下はもっともらしい既定値にすぎない。package.json に無いスクリプトを呼ぶ検査は毎ターン落ち、ゲートを無視する癖がつく（ゲートが無いより悪い）。/da-verify が作成を案内し、同スキルの reference/profile-authoring.md が各項目を説明する。",
    "",
    "match.remote は意図して所有者を書かず、フォークとクローンに追従させる。同名のリポジトリが 2 つあるときは 'owner/repo' に固定する。"
  ],
  "match": {
    "remote": "/your-repo"
  },
  "forbidden": [
    "git push --force",
    "git reset --hard"
  ],
  "checks": [
    {
      "id": "lint",
      "cmd": "pnpm run lint:fix",
      "gate": true,
      "agent_may_run": true,
      "scope": "all",
      "mutates": true
    },
    {
      "id": "typecheck",
      "cmd": "pnpm run typecheck",
      "gate": true,
      "agent_may_run": true,
      "scope": "all",
      "timeout": 180
    },
    {
      "id": "unit",
      "cmd": "pnpm exec vitest run --relative {files}",
      "gate": true,
      "agent_may_run": true,
      "scope": "changed",
      "timeout": 180
    }
  ]
}
